A.328	Proving $\sum_{k=1}^{n}\cos\frac{2\pi k}{n}=0$	I want to prove that the below equation can be held.  $$\sum_{ k=1 }^{ n  } \cos\left(\frac{  2 \pi k }{  n  } \right) =0, \qquad n>1 $$  Firstly I tried to check the equation with small values of $n$ $$  \text{As } n=2 $$ $$  \cos\left(\frac{  2 \pi \cdot 1   }{  2  } \right) + \cos\left(\frac{  2 \pi \cdot 2   }{  2   } \right)  $$ $$ = \cos\left(\pi\right)  + \cos\left(2 \pi\right)    $$ $$ = -1+ 1 =0  ~~ \leftarrow~~ \text{Obvious}  $$ But $$  \text{As}~~ n=3  $$ $$  \cos\left(\frac{  2 \pi \cdot  1   }{  3   } \right) +\cos\left(\frac{  2 \pi  \cdot  2   }{  3   } \right) + \cos\left(\frac{  2 \pi  \cdot  3   }{  3   } \right)  $$ $$ = \cos\left(\frac{  2 \pi  }{  3  } \right) + \cos\left(\frac{  4 \pi  }{  3  } \right) + \cos\left( 2\pi \right)  $$ $$ = \cos\left(\frac{  2 \pi  }{  3  } \right) + \cos\left(\frac{  4 \pi  }{  3  } \right) + 1  =?$$ What formula(s) or property(s) can be used to prove the equation?	Dokaz $\sum_{k=1}^{n}\cos\frac{2\pi k}{n}=0$	Želim dokazati da se može održati sljedeća jednačina. $$\sum_{ k=1 }^{ n } \cos\left\(frac{ 2 \pi \cdot 2 }{ n } \right) =0, \qquad n>1 $$ Prvo sam pokušao provjeriti jednačinu malim vrijednostima $n$ $$ \text{As } n=2 $$ $$ \cos\left(\frac{ 2 \pi \cdot 1 }{ 2 } \right) + \cos\left\\\frac{ 2 \pi \cdot 2 } { 2 } \right) $$ $$ \cdot \left2 \\right) + \cdot \left2 \cdot \left2 \cdot \left1 \left1 \left1 \left1 \left1 \left1 \left1 \left1 \left1 \left1 \left1 \left1 \left1 \left1 \left1 \left1 \left1 \left1 \left2 \left2 \left2 \left2 \left3 \left3 \left3 \left3 \left3 \left3 \left3 \left3 \left3 \left3 \left3 \left3 \left3 \left3 \left3 \left3 \left3 \left3 \left3 \left3 \left3 \left3 \left3 \left3 \left3 \left3 \left3 \left3 \left3 \left3 \left3 \left3 \left3 \left3 \le \left3 \left3 \left3 \le \left3 \le \left3 \le \le \left3 \le \left3 \le \le \left3 \le \le \le \le \le \left3 \le \le \le \le \le \le \left3 \le \le \le \le \le \left3 \le \le \le \le \le \le \le \le \le \le \left3 \le \le \le \le \le \le \le \le \le \le \le \le \le \le \le \le \le \le \le \le \le \le \le \le \le \le \le \le \le \le \le \le \le \le \le \le \le \le \le \le \le \le \le \le \le \le \le \le \le \le \le \le \le \le \le \le \le \le \le \le \le \le \le \le \le \le \le \le \le \le \le \le \le \le \le \le \le \le \le \le \le \le \le \le \le \le \le \le \le \le \le \le \le \le \le \le \le \le \le \le \le \le \le \le \le \le \le \le \le \le \le \le \le \le \le \le \le \le \le \le \le \le \le \le \le \le \le \le \le \le \le \le \le \le \le \le \le \le \le \le \le \le \le \le \le \le \le \le \le \le \le \le \le \le \le \le \le \le \le \le \le \le \le \le \le \le \le \le \le \le \le \le \le \le \le \le \le \le \le \le \le \le \le \le \le \le \le \le \le \le \le \le \le \le \le \le \le \le \le \le \le \le \le \le \le \le \le \le \le \le \le \le \le \le \le \le \le \le \le \le \le \le \le \le \le \le \le \le \le \le \le \le \le \le \le \le \le \le \le \le \le \	sequences-and-series,trigonometry,trigonometric-series
A.329	How do I show that if $A$ is compact and $U \supseteq A$ is open, then there is an open $V$ with $A \subseteq V \subseteq \overline{V} \subseteq U$?	This question is from Wayne Patty's Topology Section 5.2.  Consider $A$ be a compact subset of a regular space and let $U$ be an open set such that $A\subseteq U$. Prove that there is an open set $V$ such that $A \subseteq  V \subseteq \overline{V} \subseteq U$.  Let $p \in A$ which implies $p \in U$. Then a result is given in   the book (Theorem 5.11): A $T_1$-space $(X, \mathcal T)$ is regular if and only if for each member $p$ of $X$ and each neighbourhood $U$ of $p$, there is a neighbourhood $V$ of $p$ such that $\overline{V}\subseteq U$. So, I got $ V \subseteq \overline{V} \subseteq U$. But I am unable to prove that $A\subseteq V \subseteq \overline{V}$. I thought that I should let $V\subseteq \overline{V} \subseteq A$ but I am not able to find a contradiction. Can you please help with that?	Kako da pokažem da ako je $A$ kompaktan a $U \supseteq A$ otvoren, onda postoji otvoren $V$ s $A \subseteq V \subseteq \overline{V} \subseteq U$?	Ovaj je pitanje iz Wayne Patty Topologije Odjeljak 5.2. Mislite $A$ biti kompaktni podskuplje redovnog prostora i neka $U$ biti otvoreni skup takav $A\subseteq U$. Ispostavite da postoji otvoreni skup $V$ takav $A \subseteq  V \subseteq \overline{V} \subseteq U$. Neka $p \in A$ koji podrazumijeva $p \in U$. Zatim je rezultat u knjizi (Teorema 5.11): $T_1$-prostor $(X, \mathcal T)$ je redoviti ako i samo ako za svaki član $A$0 $A$1 i svaki susjed $U$ $A$0, postoji susjed $V$ $A$0 takav $A$2. Dakle, dobio sam $A$3. Ali nisam u stanju dokazati da $A$4. Mislio sam da bih trebao pustiti $A$5 ali nisam u mogućnosti pronaći kontradikciju. Možete li pomoći s tim?	general-topology,separation-axioms
A.330	Shilov's Linear Algebra - Chapter 1, Problem 9	Calculate the $n$-th order determinant: $$\Delta= \begin{vmatrix} x&a&a&\ldots&a\\ a&x&a&\ldots&a\\ a&a&x&\ldots&a\\ \cdot&\cdot&\cdot&\ldots&\cdot\\ a&a&a&\ldots&x \end{vmatrix}$$ The answer is $\Delta=[x+a(n-1)](x-a)^{n-1}$. If we add all the other columns to the first column, we get the first multiplicative factor of the answer, and are left with the following determinant: $$\begin{vmatrix} 1&a&a&\ldots&a\\ 1&x&a&\ldots&a\\ 1&a&x&\ldots&a\\ \cdot&\cdot&\cdot&\ldots&\cdot\\ 1&a&a&\ldots&x \end{vmatrix}$$ How can we calculate this determinant to obtain the answer?	Shilovova linearna algebra - poglavlje 1, Problem 9	Računajte $n$-te odreditelje reda: $$\Delta= \begin{vmatrix} x&a&a&&\ldots&a\\ a&x&a&&\ldots&a\\ a&a&x&&\ldots&a\\ \cdot&\cdot&\cdot&\ldots&\cdot a&a&a&\ldots&x \end{vmatrix} $$ Odgovor je $\Delta=[x+a(n-1)](x-a)^{n-1}$. Ako dodamo sve ostale stupnjeve u prvi stupnji, dobivamo prvi množenik koeficijent odgovora, a ostajemo sa odrediteljem: $$\begin{vmatrix} 1&a&a&\ldots&a\\ 1&x&a&ldots&a&a&a&a&a&a\ldots&a&a&a\c\c\c\c\c\c\c\c\c\c\c\c\c\c\c\c\c\c\c\c\c\c\c\c\c\c\c\c\c\c\c\c\c\c\c\c\c\c\c\c\c\c\c\c\c\c\c\c\c\c\c\c\c\c\c\c\c\c\c\c\c\c\c\c\c\c\c\c\c\c\c\c\c\c\c\c\d\c\c\c\c\c\c\c\c\c\c\c\c\c\c\c\d\c\c\c\c\c\c\d\c\c\c\c\c\c\d\c\c\d\d\c\d\d\d\d\d\d\d\d\d\d\d\d\d\d\d\d\d\d\d\d\d\d\d\d\d\r\r\r\r\r\r\r\r\r\r\r\r\r\r\r\r\r\r\r\r\r\r\r\r\r\r\r\r\r\r\r\r\r\r\r\r\r\r\r\r\r\r\r\r\r\r\r\r\r\r\r\r\r\r\r\r\r\r\r\r\r\r\r\r\r\r\r\r\r\r\r\r\r\r\r\r\r\r\r\r\r\r\r\r\r\r\r\r\r\r\r\r\r\r\r\r\r\r\r\r\r\r\r\r\r\r\r\r\r\r\r\r\r\r\r\r\r\r\r\r\r\r\r\r\r\r\r\r\r\r\r\r\r\r\r\r\r\r\r\r\r\r\r\r\r\r\r\r\r\r\r\r\r\r\r\r\r\r\r\r\r\r\r\r\r\r\r\r\r\r\r\r\r\r\r\r\r\r\r\r\r\r\r\r\r\r\r\r\r\r\r\r\r\r\r\r\r\r\r\r\r\r\r\r\r\r\r\r\r\r\r\r\r\r\r\r\r\r\r\r\r\r\r\r\r\r\r\r\r\r\r\r\r\r\r\r\r\r\r\r\r\r\r\r\r\r\r\r\r\r\r\r\r\r\r\r\r\r\r\r\r\r\r\r\r\r	linear-algebra,determinant
A.331	Finding roots of $4^x+6^x=9^x$ by hand	The function $f(x)=4^x+6^x-9^x$ is such that $f(0)=1>0, f(1)=1>0, f(2)=-29$ and next $g(x)=(4/9)^x+(6/9)^x-1 \implies f'(x)<0$ for all real values of $x$. So $g(x)$ being monotonic the equation $$4^x+6^x=9^x$$ has exactly one real solution. The question is whether this real root can be found analytically by hand.	Rječi $4^x+6^x=9^x$ ručno pronalaženje	Funkcija $f(x)=4^x+6^x-9^x$ je takva da $f(0)=1>0, f(1)=1>0, f(2)=-29$ i sljedeći $g(x)=(4/9)^x+(6/9)^x-1 \implies f'(x)<0$ za sve stvarne vrijednosti $x$. Dakle, $g(x)$ je monotonna jednačina $$4^x+6^x=9^x$$ ima točno jedno stvarno rješenje.	real-analysis
A.332	Every number can be expressed as a product of (least prime factor)*(largest integer dividing n less than n) [EDITED]	Let $L:{\Bbb N} \to {\Bbb N}$ such that $L(n) = {\text{least prime factor p of n}}$. Let $g:{\Bbb N} \to {\Bbb N}$ such that $g(n) = {\text{biggest positive integer d such that d|n and 1}} \leqslant {\text{d < n}}$. Show that:$$g(n) = \frac{n}{{L(n)}},\forall n \in {\Bbb N}{\text{ such that }}n \geqslant 2$$ My proof: Since $n \geqslant 2$, $n$ is either composite or prime. If $n$ is prime(i.e $n = p$ where $p$ is prime), then $$g(n) = 1 = \frac{p}{p} = \frac{n}{{L(n)}}$$ This is because $L(n)$ is defined as least prime factor of n. If$n $is composite, by the Fundamental Theorem of Arithmetic: "Any positive integer bigger than 1 can be expressed as a product of primes." Let $p$ be the smallest prime of the product $$n = {p_1}^{{\alpha _1}}p_2^{{\alpha _2}}...{p_m}^{{\alpha _m}},{\text{ }}i < j,{\text{ }}{p_i} < {p_j}{\text{ and }}i,j \in {{\Bbb Z}^ + }{\text{ and }}{\alpha _i} \in {{\Bbb Z}^{ \geqslant 0}}$$ That is, pick $p = p_1$. Notice that $p$ is necessarily $L(n)$ because since $p = p_1$ implies that $p|n$ and is the smallest prime that divides n. Therefore, $$p_1 = p = L(n)$$ Then, if $x = p = L(n)$, then $1 < x < n$ and $x|n$ (by definition). This implies that $$\exists y \in {{\Bbb Z}^ + }:y = \frac{n}{x} = \frac{n}{{L(n)}} = {p_1}^{{\alpha _1} - 1}{p_2}^{{\alpha _2}}...{p_m}^{{\alpha _m}}$$ But $y|n$ such that $y < n$. Implies that $y$ is the greatest integer less than$n $such that $y|n$. Now let $d = g(n)$. Since $$\frac{n}{d} = \frac{n}{{g(n)}} = m$$ then $m$ is prime and $m = p$. BWOC, If $n=md$ and $m = ab$ where $1 < a,b < m \Rightarrow n = abd \Rightarrow ad|n$. Since $1. But we found another factor of $n$ ($ad$) that divides $n$! This contradicts the definition of $d=g(n)$. Also, since $d = g(n)$ is the biggest factor of n, implies that $m = \frac{n}{d} = \frac{n}{g(n)}$ is the smallest prime factor of n. So $m = L(n) = p$. Hence, we have that $$x = m = p = L(n) = \frac{n}{g(n)} \Rightarrow g(n) = \frac{n}{p} =\frac{n}{L(n)} = y$$ or just $$g(n) = \frac{n}{L(n)}$$ Q.E.D.	Svaki broj može se izraziti kao proizvod (najmanji primni faktor) *(najveći cijeli broj dijeli n manje od n) [EDITED]	Neka $L:{\Bbb N} \to {\Bbb N}$ tako da $L(n) = {\text{least prime factor p of n}}$. Neka $g:{\Bbb N} \to {\Bbb N}$ tako da $g(n) = {\text{biggest positive integer d such that d|n and 1}} \leqslant {\text{d < n}}$. Pokaži da:$$g(n) = \frac{n}{{{{{{{{{{L(n)}} {{{{L}}}}{\L}}{\L}}{\L}}{\L}}{\L}}{\L}}{\L}}{\L}}{\L}}{\L}}{\L}}{\L}}{\L}}{\L}}{\L}}{\L}}{\L}}{\L}}{\L}}{\L}}{\L}}{\L}}{\L}}{\L}}{\L}}{\L}}{\L}}{\L}}{\L}}{\L}}{\L}}{\L}}{\L}}{\L}}{\L}}{\L}}{\L}}{\L}}{\L}}{\L}}{\L}}{\L}}{\L}}{\L}}{\L}}{\L}}{\L}}{\L}}{\L}}{\L}}{\L}}{\L}}{\L}}{\L}}{\L}}{\L}}{\L}}{\L}}{\L}}{\L}}{\L}}{\L}}{\L}}{\L}}{\L}}{\L}}{\L}}{\L}}{\L}}{\L}}{\L}}{\L}}{\L}}{\L}}{\L}}{\L}}{\L}}{\L}}{\L}}{\L}}{\L}}{\L}}{\L}}{\L}{\L}{\L}{\L}{\L}{\L}{\L}{\L}{\L}{\L}{\L}{\L}{\L}{\L}{\\\\\\\\\\\L}{\\\\\\\\\\\\\\\\\\\\\\\\\\\\\\\\\\\\\\\\\\\\\\\\\\\\\\\\\\\\\\\\\\\\\\\\\\\\\\\\\\\\\\\\\\\\\\\\\\\\\\\\\\\\\\\\\\\\\\\\\\\\\\\\\\\\\\\\\\\\\\\\\\\\\\\\\\\\\\\\\\\\\\\\\\\\\\\\\\\\\\\\\\\\\\\\\\\\\\\\\\\\\\\\\\\\\\\\\\\\\\\\\\\\\\\\\\\\\\\\\\\\\\\\\\\\\\\\\\\\\\\\\\\\\\\\\\\\\\\\\\\\\\\\\\\\\\\\\\\\\\\\\\\\\\\\\\\\\\\\\\\\\\\\\\\\\\\\\\\\\\\\\\\\\\\\\\\\\\\\\\\\\\\\\\\\\\\\\\\\\\\\\\\\\\\\\\\\\\\\\\\\\\\\\\\\\\\\\\\\\\\\\\\\\\\\\\\\\\\\\\\\\\\\\\\\\\\\\\\\\\\\\\\\\\\\\\\\\\\\\\\\\\\\\\\\\\\\\\\\\\\\\\\\\\\\\\\\\\\\\\\\\\\\\\\\\\\\\\\\\\\\\\\\\	elementary-number-theory
A.333	Bivariate normal density	$( X, Y)$ have a bivariate normal density centered at the origin with $E(X^2)$ = $E(Y^2) = 1$, and $E(XY) = p$ . In polar coordinates $(X, Y)$ becomes $(R,\Phi)$ where $R^2 = X^2 + Y^2$. Prove that $\Phi$ has a density given by $$\frac{\sqrt{1-p^2}}{2\pi(1-2p\sin(\varphi)\cos(\varphi))}$$ And is uniformly distributed iff $p = 0$. (To this point everything is clear) what i do not understand is how to conclude that $P\{XY > 0\} =  \frac{1}{2} +\pi^{-1} \arcsin (p)$ and $P\{XY < 0\}= \pi^{-1} \arccos (p)$.	Bivalentna normalna gustoća	$( X, Y)$ ima bivarijalnu normalnu gustoću središtu na izvoru s $E(X^2)$ = $E(Y^2) = 1$ i $E(XY) = p$ . U polarnim koordinatama $(X, Y)$ postaje $(R,\Phi)$ gdje $R^2 = X^2 + Y^2$. Ispostavite da $\Phi$ ima gustoću koju daje $$\frac{\sqrt{1-p^2}}{2\pi(1-2p\sin(\varphi)\cos(\varphi))}$$ I je jednako raspoređen iff $( X, Y)$0. (Do sada je sve jasno) ono što ne razumijem je kako zaključiti da $( X, Y)$1 i $( X, Y)$2.	probability,probability-theory,probability-distributions
A.334	logarithm proof for $a^{log_a(b)}=b$	I have tried proving for $a^{log_a(b)}=b$ , but I feel is incorrect, so how can I prove this? I have proved it as follows: $log_aa^{log_a(b)}=log_ab$ $log_a(b)log_aa= log_ab$ $log_a(b)= log_ab$	logaritmski dokaz za $a^{log_a(b)}=b$	Pokušao sam dokazati za $a^{log_a(b)}=b$, ali osjećam da je pogrešno, tako da kako mogu dokazati ovo?	logarithms
A.335	Matrix exponential converges to a matrix	Let $A$ be a square matrix. To show: Matrix exponential converges to some matrix $X$. $$ \lim_{N \rightarrow \infty} \sum_{k=0}^{N}\frac{A^k}{k!} =X  $$ In some proofs that I have seen it is stated that because (for a sub-multiplicative norm) $$ 0 \le  \sum_{k=0}^{\infty} \left\Vert  \frac{A^k }{k!} \right\Vert  \le  \sum_{k=0}^{N} \frac{\Vert A \Vert ^k }{k!} then the series $\sum_{k=0}^{N}\frac{A^k}{k!}$ has to be convergent. That however isn't clear to me. To me more intuitive way to show convergence would be to show that $$ \lim_{N \rightarrow \infty} \left\Vert \sum_{k=0}^{N} \frac{A^k}{k!} -X \right\Vert  =0$$ and use some intuitive matrix norm for which it is clear that all elements of $\frac{A^k}{k!} -X$ converge to zero. Any hints?	Eksponencijalna matrica konvergira u matricu	$A$ je kvadratna matrica. Da pokažemo: Eksponencijalna matrica konvergira do neke matrice $X$. $$ \lim_{N \rightarrow \infty} \sum_{k=0}^{N}\frac{A^k}{k!} =X $$ U nekim dokazima koje sam vidio navodi se da je zato što (za sub-multiplikativnu normatu) $$ 0 \le \sum_{k=0}^{\infty} \left\\frac{A^k }{k!} \right\Vert \Vert \Vert \_sum{k=0}{N} \frac{\Vert A \k }{k!} onda je niz $\sum_{k=0}^{N}\frac{A^k}{k!}$ mora biti čvrsti. To mi nije jasno. Međutim, da pokažem mi više intuitivne konvergencije kako bi se koristili elementi $$ \n}{k} \n}{n}{n}{n}{n}{n}{n}{n}{n}{n}{n}{n}{n}{n}{n}{n}{n}{n}{n}{n}{n}{n}{n}}{n}{n}{n}}{n}{n}}{n}{n}{n}{n}}{n}{n}}{n}{n}{n}}{n}{n}}{n}{n}{n}{n}}{n}{n}{n}}{n}}{n}{n}}{n}{n}{n}}{n}}{n}{n}{\frac}}{n}}}{n}{n}}{n}{n}}{n}{n}}{n}{n}{n}}{n}{n}}{n}{n}{n}{n}{n}{n}{n}}{n}{n}{n}{n}}{n}{n}{n}{n}{n}{n}{n}{n}{n}}}{n}{n}}{n}{n}{n}{n}{n}{n}{\nu}}}{n}{n}{n}{n}{n}{n}{n}{n}{n}{n}{n}}{\nu}}}}{n}{n}{n}{n}{\nu}{n}{\nu}{n}{n{n{n}}}}{n{n{n{n}{n}}}{\nu}}{n{n}{n{n{\nu}{n{\nu}{n}{n}{n}{\nu}{n}{n}}}{n{n{n}}{\nu}}}}{n{n{\nu}{n}{\nu}{n}{n}{\nu}{n{n{n}{n}{n}{\nu}{n}{n{n{n}{n{\nu}}{\nu}}}{\nu}{\nu}{n{n}}}}{n{n{n{n{n}{\nu}}}}}{n{\nu}{n{n{n{n{n}}}}}}}}{\nu}{n{\nu}{\nu}{\nu}{\nu}{n{n{\nu}{n{\nu}{n{\nu}{\nu}{n{\nu}{nu}{nu}{nu}{nu}{nu}{nu}{\nu}{nu}{\nu}{nu}{nu}{nu}{\nu}{nu}{\nu}{nu}{nu}{nu}{nu}{nu}{nu}{nu}{nu}{nu}{nu}{nu}{nu}{nu}{nu}{nu}{nu}{nu}{nu}{nu}{nu}{nu}{nu}{nu}{nu}{nu}{nu}{nu}{nu}{nu}{nu}{nu	matrix-exponential
A.336	For each $n \in \mathbb{N}$, specify matrices $A, B \in \mathbb{R}^{n \times n}$ for which $A B \neq B A$ is true.	I have got the following task: (1) For each $n \in \mathbb{N}$, specify matrices $A, B \in \mathbb{R}^{n \times n}$ for which $A B \neq B A$ is true. (2) Determine $$ M:=\left\{A \in \mathbb{R}^{2 \times 2}: A B=B A \quad \forall B \in \mathbb{R}^{2 \times 2}\right\} $$ thus the matrices $A \in \mathbb{R}^{2 \times 2}$, which commute with all matrices $B \in \mathbb{R}^{2 \times 2}$. Could someone please help me with this or give me an approach? That would be very helpful. Thanks.	Za svaki $n \in \mathbb{N}$, navedi matrice $A, B \in \mathbb{R}^{n \times n}$ za koje je $A B \neq B A$ istinito.	Imam sljedeći zadatak: (1) Za svaki $n \in \mathbb{N}$, navedi matrice $A, B \in \mathbb{R}^{n \times n}$ za koje je $A B \neq B A$ istina. (2) Odredi $$ M:=\left\{A \in \mathbb{R}^{2 \times 2}: A B=B A \quad \forall B \in \mathbb{R}^{2 \times 2}\right\} $$ tako matrice $A \in \mathbb{R}^{2 \times 2}$, koje se kreću s svim matricama $B \in \mathbb{R}^{2 \times 2}$. Može li mi netko pomoći s ovim ili mi dati pristup? To bi bilo vrlo korisno. Hvala.	linear-algebra,matrices
A.337	Suppose that all the tangent lines of a regular plane curve pass through some fixed point. Prove that the curve is part of a straight line.	Question. Suppose that all the tangent lines of a regular plane curve pass through some fixed point. Prove that the curve is part of a straight line. Prove the same result if all the normal lines are parallel. I am working on differential geometry from the book by Pressley and I have a doubt in the solution of the above question whose (brief) solution is given by: Solution: We can assume that the curve $\gamma$ is unit-speed and that the tangent lines all pass through the origin (by applying a translation to $\gamma$). Then, there is a scalar $\lambda(t)$ such that $\gamma'(t) = \lambda(t)\gamma(t)$ for all $t$. Then, $\gamma '' = \lambda'\gamma   + \lambda \gamma' = (\lambda' + \lambda^2)\gamma$. Can anyone please explain me how does this line follow : " Then, there is a scalar $\lambda(t)$ such that $\gamma'(t) = \lambda(t)\gamma(t)$ for all $t$." Thanks in advance.	Pretpostavimo da sve tangentne linije redovne ravnine prolaze kroz određenu fiksnu tačku.	Pretpostavimo da sve tangentne linije redovne ravnine prolaze kroz određenu fiksnu tačku. Ispostavimo da je krivulja dio ravne linije. Ispostavimo isti rezultat ako su sve normalne linije paralelne. Radim na diferencialnoj geometriji iz knjige Pressleya i sumnjam u rješenje gore navedenega pitanja čije je (kratko) rješenje: Rješenje: Možemo pretpostaviti da je krivulja $\gamma$ jedinična brzina i da sve tangentne linije prolaze kroz izvor (primijenjem prevod na $\gamma$).	differential-geometry,curves,tangent-line
A.338	Find all integer solutions of equation $y = \frac{a+bx}{b-x}$	How to find all integer solutions for the equation $y = \frac{a+bx}{b-x}$, where a and b are known integer values? P.S. x and y must be integer at the same time	Pronađite sve čestice rješenja jednačine $y = \frac{a+bx}{b-x}$	Kako pronaći sve čestice rješenja za jednadžbu $y = \frac{a+bx}{b-x}$, gdje su a i b poznate čestice vrijednosti?	elementary-number-theory,diophantine-equations
A.339	Extension of Euclid's lemma	This is$a $somewhat obvious fact that is intuitively obvious to me, but I haven't been able to construct a proof of it. Euclid's lemma states for for $p$ a prime and $ab$ a product of integers (let's take everything to be positive for simplicity), if $p \mid ab$, then $p \mid a$ or $p \mid b$. This is clear, and I know how to prove it. Let's extend it somewhat. Suppose that $a$ and $b$ are two relatively prime integers, and we have $a \mid bc$ for some other integer $c$. Then $a \not \mid b$, so it must divide $c$. This fact is obvious to me, but I can't figure out how to prove it. Does anyone have any hints or advice? Do I need the assumption of positivity? (For my purposes at the moment, I only need them to be positive, but there is value in having the most general result possible). EDIT: Updated attempt: We have that $a,b$ are relatively prime, so there exist $r,s \in \mathbb{Z}$ such that $ar + bs = 1$ by Bézout's lemma. Multiply through by $c$ to get $arc + bsc = c$. Then $a \mid arc$ and $a \mid bsc$, so $a \mid c$. How is that?	Objašnjenje Euklidove lemme	To je $a $nekako očito činjenica koja mi je intuitivno očita, ali nisam uspio napraviti dokaz za to. Euclidova lemma kaže za $p$ prvo i $ab$ proizvod celina (preuzmite sve da bude pozitivno za jednostavnost), ako $p \mid ab$, onda $p \mid a$ ili $p \mid b$. Ovo je jasno, i znam kako ga dokazati. Neka ga malo proširimo. Pretpostavimo da su $a$ i $b$ dva relativno prvo cjelina, a imamo $a \mid bc$ za neki drugi cjelin broj $a $0. Onda $a $1, tako da je to mora podijeliti $a $0. To je očito za mene, ali ne mogu shvatiti kako to dokazati. Ima li bilo kakvih sugestija ili savjeta? Trebam li pretpostavku pozitivnog stanja? (Za moje svrhe u ovom trenutku, moram samo biti relativno, ali je u općenitoj vrijednosti ED15.	elementary-number-theory
A.340	I have the following problem: Let $|x_{n+1} - x_n| < 1/3^n$. Show that $(x_n)$ is a Cauchy sequence.	We have that $(x_n)$ is a sequence of real numbers. And the relation on the title: $$ |x_{n+1} - x_n| < \frac{1}{3^n}. $$ We must prove that this is a Cauchy sequence. I know that an Cauchy sequence follows the definition: given $\epsilon>0$, exists $n_0 > 0$, such that $m,n > n_o \Rightarrow |x_m - x_n|< \epsilon$ But I don't know how to use both informations to prove the exercise. If someone please may help me, I'd be very thankful.	Imam sljedeći problem: pokaži da je $(x_n)$ Cauchyjev niz.	Imamo da je $(x_n)$ niz stvarnih brojeva. I odnos na naslovu: $$ x_{n+1} - x_n  < \frac{1}{3^n}. $$ Moramo dokazati da je to Cauchy niz. Znam da Cauchy niz slijedi definiciju: dato $\epsilon>0$, postoji $n_0 > 0$, tako da $m,n > n_o \Rightarrow |x_m - x_n|< \epsilon$ Ali ne znam kako koristiti obje informacije da dokažem vježbu. Ako mi netko može pomoći, bio bih vrlo zahvalan.	real-analysis,sequences-and-series
A.341	Do all arithmetic sequences with coprime coefficients contain a prime?	Given $a, b \in Z^+$, where $\gcd(a, b) = 1$, we can define an arithmetic sequence $c_i = a + i \cdot b$. The sequence is thus $\{a, a+b, a+2b, \cdots\}$. Do all such sequences contain a prime? Do they contain an infinite number of primes? Example: $a=2, b=3$. Then, $c_1 = a+b = 5$, which is prime. Meanwhile, $a=4, b=2$ does not have primes, but $\gcd(a, b) = 2 \neq 1$, so this isn't a counterexample.	Da li sve aritmetske sekvence sa koefficientima koprima sadrže prvo?	S obzirom na $a, b \in Z^+$, gdje je $\gcd(a, b) = 1$, možemo definirati aritmetiku $c_i = a + i \cdot b$. Sekuencja je tako $\{a, a+b, a+2b, \cdots\}$. Da li sve takve sekvence sadrže prvo? Da li sadrže beskonačan broj prvočunja? Primjer: $a=2, b=3$.	elementary-number-theory,arithmetic-progressions,coprime
A.342	Four students are giving presentations	In four sections of a course, running (independently) in parallel, there are four students giving presentations that are each Exponential in length, with expected value of$10 $minutes each. How much time do we expect to be needed until all four of the presentations are completed? I'm a little thrown off by this question since it's in the chapter of order statistics in my book. But I believe that this is just gamma distribution. If each student has expected value of $10$ minutes each. Shouldn't the time needed till all four of the presentations are completed be $40$ minutes? $(10 \cdot 4 = 40)$ Or is it the following. Calculate the density of the fourth order statistics $$f(x_4) =\frac{2}{5}e^{\frac{-x}{10}}\left(1-e^{\frac{-x}{10}}\right)^3.$$ Then $$E(X_4) = \int_0^\infty\frac{2x}{5}e^\frac{-x}{10}\left(1-e^\frac{-x}{10}\right)^3 \,dx= 125/6.$$ So is the answer $40$ minutes or $125/6$ minutes? Any help is greatly appreciated.	Četiri učenika daju prezentacije	U četiri odjeljka kursa, koji se provode (nezavisno) paralelno, četiri studenta daju prezentacije koje su svaki eksponencijalni u dužini, s očekivanom vrijednošću od $10 $ minuta svaki. Koliko vremena očekujemo da će biti potrebno dok se sve četiri prezentacije završe? Malo sam odbačen ovim pitanjem jer je u poglavlju statistike reda u mojoj knjizi. Ali vjerujem da je to samo gamma raspodjela. Ako je svaki učenik očekivao vrijednost $10$ minuta svaki. Nije potrebno vrijeme do završetka svih četiri prezentacije biti $40$ minuta? $(10 \cdot 4 = 40)$ Ili je to.	solution-verification,exponential-distribution,order-statistics,gamma-distribution
A.343	When two dice are identical, why are ordered pairs considered for determining probability of getting sum x?	Problem statement : +++++++++++++++ Given two identical unbiased dice, determine the probability of getting sum as 7. Event  = Sum of dots on the top face of both dice is 7. $E = {(1,6),\ (2,5),\ (3,4),\ (4,3),\ (3,4),\ (5,2),\ (6,1)}$ $|Sample Space|$ = $36$. Hence, $P(E) = 1/6$ I have a doubt here. As the two dice are given identical, why do we have to consider ordered pairs? Shouldn't it be unordered consisting of only 3 possible pairs $\{(1,6),\ (2,5),\ (3,4)\} $? Hence, $|S| = 21$ and $P(E) = 3/21$.	Kada su dvije kockice identične, zašto se u određivanju vjerovatnoće dobivanja sume x uzimaju u obzir poruke u redovnom redu?	Problem: +++++++++++++++++++++++++++++++++++++++++++++++++++++++++++++++++++++++++++++++++++++++++++++++++++++++++++++++++++++++++++++++++++++++++++++++++++++++++++++++++++++++++++++++++++++++++++++++++++++++++++++++++++++++++++++++++++++++++++++++++++++++++++++++++++++++++++++++++++++++++++++++++++++++++++++++++++++++++++++++++++++++++++++++++++++++++++++++++++++++++++++++++++++++++++++++++++++++++++++++++++++++++++++++++++++++++++++++++++++++++++++++++++++++++++++++++++++++++++++++++++++++++++++++++++++++++++++++++++++++++++++++++++++++++++++++++++++++++++++++++++++++++++++++++++++++++++++++++++++++++++++++++++++++++++++++++++++++++++++++++++++++++++++++++++++++++++++++++++++++++++++++++++++++++++++++++++++++++++++++++++++++++++++++++++++++++++++++++++++++++++++++++++++++++++++++++++++++++++++++++++++++++++++++++++++++++++++++++++++++++++++++++++++++++++++++++++++++++++++++++++++++++++++++++++++++++++++++++++++++++++++++++++++++++++++++++++++++++++++++++++++++++++++++++++++++++++++++++++++++++++	probability
