A.76	Covering $\mathbb{Z}$ by arithmetic progressions	I am solving problems from an old exam (in topology, but I've translated the problem into more algebraic terms). The problem is the following:  Let $a+b\mathbb{Z}=\{z\in \mathbb{Z}\mid z = a+bk \text{ for some  }k\in \mathbb{Z}\}$ where $a\in \mathbb{Z}$ and $b\in  \mathbb{Z}-\{0\}$. Suppose we have a collection of such sets   $\{a_i+b_i\mathbb{Z}\mid i \in \mathbb{N}\}$   satisfying: $$\bigcup_{i \in \mathbb{N}}(a_i+b_i\mathbb{Z})=\mathbb{Z}$$ Show whether it is always possible to extract a finite   $I\subset \mathbb{N}$ s.t. $$\bigcup_{i \in I}(a_i+b_i\mathbb{Z})=\mathbb{Z}$$  Unfortunately, I seem to have forgotten a lot of my elementary algebra... Nevertheless, I have attempted something: Let $\{p_k\}=\{2,3,5,\dots\}$ be the set of primes. We can construct: $$\left(\bigcup_{k\in \mathbb{N}}(0+p_k\mathbb{Z})\right)\cup (-1+\ell_1 \mathbb{Z})\cup (1+\ell_2\mathbb{Z})=\mathbb{Z}$$ for some appropriate non-negative integers $\ell_1,\ell_2$. We could for instance pick $\ell_1=\ell_2=5$. Suppose there is a finite sub-collection $\{0+p_{k_j}\}$, $j=1,\dots,n$ s.t.  $$\left(\bigcup_{1\leq j\leq n}(0+p_{k_j}\mathbb{Z})\right)\cup (-1+5 \mathbb{Z})\cup (1+5\mathbb{Z})$$ Now, assume $p$ is some prime s.t. $p>\max\{p_{k_1},\dots,p_{k_n}\}$, then clearly $p\notin \bigcup_{1\leq j\leq n}(0+p_{k_j}\mathbb{Z})$. But here I run into a problem. I want $p\notin(-1+5 \mathbb{Z})\cup (1+5\mathbb{Z})$. That is, I want $5\nmid p-1$ and $5\nmid p+1$. This is of course possible if $p$ is a prime with a $7$ as its last digit. However, this approach means I have to prove that there are infinitely many primes ending on a $7$, which seems like a silly thing to prove for a simple problem like this. Surely, there is a nicer way of solving this? EDIT: I am particularily interested in a solution not relying on topology, and whether a solution like my attempted solution works.	S obzirom na to da se u skladu s člankom 1. stavkom 1. točka 1.	Rešavam probleme iz starog ispita (u topologiji, ali sam problem prevodila u više algebričkih izraza). Problem je sljedeći: da $a+b\mathbb{Z}=\{z\in \mathbb{Z}\mid z = a+bk \text{ for some  }k\in \mathbb{Z}\}$ gdje $a\in \mathbb{Z}$ i $b\in  \mathbb{Z}-\{0\}$. Pretpostavimo da imamo skup takvih skupova $\{a_i+b_i\mathbb{Z}\mid i \in \mathbb{N}\}$ zadovoljavajuće: $$\bigcup_{i \in \mathbb{N}}(a_i+b_i\mathbb{Z}) =\mathbb{Z}$$ Pokažite je li uvijek moguće izvući krajnji $I\subset \mathbb{N}$ s.t. $$\bigcup_{i \in I}(a_i+b_i\mathbb{Z}) =\mathbb{Z}$$ Nažalost, čini se da sam proučio puno problema elementarne algebre...{i \in \mathbb{N}}{17.}Nikoli, pokušavao sam dokazati da je to moguće, ali da je nešto jednostavno kao da je priminski skup $a+b\mathbb{Z}=\{z\in \mathbb{Z}\mid z = a+bk \text{ for some  }k\in \mathbb{Z}\}$4.{\in}{i}{i}{i}{i}{i}{i}{i}{i}{i}{i}{i}{i}{i}{i}{i}{i}{i}{i}{i}{i}}{i}{i}}{i}{i}}{i}}{i}{i}}{i}}{i}{i}}{i}}{i}{i}}{i}}{i}}{i}{i}}}{i}{i}}{i}{i}}{i}}}{i}{i}}{i}{i}}{i}}{i}{i}{i}{i}}}{i}{i}}}{i}i}{i}{i}i}}{i}{i}}}{i}{i}}}{i}}{i}{i}}{i}{i}}}}}{i}{i}}{i}{i}}{i}}}{i}{i}{i}}{i}}{i}}{i}}}{i}}}{i}}}{i}}{i}{i}}}{i}{i}}{i}{i}}}{i}}{i}{i}}}{i}}}{}}{i}{}}{i}}}}{}}{}{i}}}}{}{}}}}{}}}}{}{i}{}}{}}{}}{}{}}}{}{}}}}{}{}{}}}}}}{}{}{}{}}{}{}{}{}}}}{}}{}{}{}}}}}}{}{}{}}}}}{}{}{}{}{}}}}}{}{}}}{}{}}}{}{}}}}}{}{}{}}{}{}{}}}{}{}{}}}}{}}}}}{}{}{}}}{}}{}{}{}}}{}{}{}{}{}}}}}{}{}{}{}{}}{}{}}}}}}}{}}}{}{}{}}{}{}}}}}}}{}{}{}{}{}{}}}}{}{}{}}{}{}}}}{}{}}}}{}{}{}}}{}{}{}}}{}{}}}{}{}{}{}{}{}}}}}{}{}{}{}{}{}{}{}}}{}{}{}}}{}{}}}{}{}{}}{}}}}}{}{}{}{}{}{}}}}}}}{}{}{}{}}}}}}{}{}{}{}{}{}{}}{}}{}{}{}{}{}}}{}{}}}}}{}{}}	general-topology,elementary-number-theory
A.77	Show that the relation $(- 1) (- 1) = 1$ is a consequence of the distributive law	Show that the relation $(- 1) (- 1) =  1$ is a consequence of the distributive law.  This question is the first problem from 'Number Theory for Beginners" by Andre Weil. I cannot get the point from where to begin. I tried using $1\cdot 1 = 1$ and $ 1\cdot x = x $, but couldn't get somewhere. Can you help me just with a hint? I would be willing to work up from there.	Pokažite da je odnos $(- 1) (- 1) = 1$ posljedica distributivnog zakona	Pokažite da je odnos $(- 1) (- 1) =  1$ posljedica distributivnog zakona. Ovo pitanje je prvi problem iz 'Theory of Numbers for Beginners' Andre Weil. Ne mogu dobiti tačku od gdje početi. Pokušao sam koristiti $1\cdot 1 = 1$ i $ 1\cdot x = x $, ali ne mogu doći negdje. Možete li mi pomoći samo sa naznanjem?	elementary-number-theory
A.79	Inequality with complex exponential	Rudin in Real and Complex Analysis uses this in a proof near the beginning of chapter 9:  $\displaystyle \left \vert{ \frac {e^{-ixu}-1}{u}}\right\vert \le \vert x \vert$ for all real $u \ne 0$  Why is this true? Edit: I believe $x$ is real	Nejednakost s kompleksnim eksponencijalnim	Rudin u stvarnoj i kompleksnoj analizi koristi ovo u dokazu blizu početka poglavlja 9: $\displaystyle \left \vert{ \frac {e^{-ixu}-1}{u}}\right\vert \le \vert x \vert$ za sve stvarne $u \ne 0$ Zašto je to istina?	inequality,exponential-function,fourier-transform
A.80	Why does this proof that the set of all finite subsets of N is a countable set not work for the set of all subsets of N?	I found this proof in a StackExchange thread and found it pretty understandable and simple: "The other answers give some sort of formula, like you were trying to do.  But, the simplest way to see that the set of all finite subsets of $\mathbb{N}$ is countable is probably the following. If you can list out the elements of a set, with one coming first, then the next, and so on, then that shows the set is countable.  There is an easy pattern to see here.  Just start out with the least elements. $$\emptyset, \{1\}, \{2\}, \{1, 2\}, \{3\}, \{1, 3\}, \{2, 3\}, \{1, 2, 3\}, \{4\}, \ldots$$ In other words, first comes $\{1\}$, then comes $\{2\}$.  Each time you introduce a new integer, $n$, list all the subsets of $[n] = \{1, 2, \ldots, n\}$ that contain $n$ (the ones that don't contain $n$ have already showed up).  Therefore, all subsets of $[n]$ show up in the first $2^{n}$ elements of this sequence." I understand how it applies for finite subsets of N, but I cant really pinpoint of why it would not apply to a set of all subsets of N. We could continue this scheme for ever, couldnt we?  I assume that I think in a wrong way about infinity but I am not quite sure. Any help is greatly appreciated!	Zašto ovaj dokaz da je skup svih krajnjih podmještaja N obračunljiv skup ne radi za skup svih podmještaja N?	Ako možete popisati elemente seta, s jednim dolazi prvi, zatim sljedeći, itd., onda to pokazuje da je skup brojivi. Ovdje je jednostavan uzorak vidjeti. Samo počnite s najmanje. $$\emptyset, \{1\}, \{1, 2\}, \{3\}, \{1, 3\}, \{2, 3\}, \{2, 3\}, \{4\}, u drugim riječima, $\{1\}$XX, onda dolazi, onda možemo nastaviti s tim.	analysis,elementary-set-theory,proof-explanation
A.81	Any infinite set contains a countable subset. Why is my proof wrong? (Axiom of Choice)	Let $M$ be an infinite set.    Proposition 1:   For any $n \in \mathbb{N}$, there exists an injection from $\{1, \cdots, n\}$ to $M$.      (1) Since $M \neq \emptyset$, there exists $x \in M$. Define $f(1)$ as $f(1) := x$. $f$ is an injection from $\{1\}$ to $M$. (2) Suppose that there exists an injection $f$ from $\{1, \cdots, n\}$ to $M$. Since $M$ is an infinite set, $M - \{f(1), \cdots, f(n)\}$ is not an empty set. So, there exists $x \in M - \{f(1), \cdots, f(n)\}$. Define $g(1), \cdots, g(n+1)$ as $g(1) := f(1), \cdots, g(n):=f(n)$ and $g(n+1) := x$. Obviously, $g$ is an injection from $\{1, \cdots, n+1\}$ to $M$.   Let $n_1$ be an arbitrary natural number. If I wanna calculate $h(n_1)$, then I get an injection $g$ from $\{1, \cdots, n_1\}$ to $M$ by Proposition 1. And I return $g(n_1)$ as the value of $h(n_1)$. And I store the pairs $(1, g(1)), \cdots, (n_1, g(n_1))$ to my database.   If I wanna calculate $h(n_2)$ for $n_2 \leq n_1$, then I search my database and I get the value $g(n_2)$ from my database and I return $g(n_2)$ as the value of $h(n_2)$. If I wanna calculate $h(n_3)$ for $n_3 > n_1$, then I add the pairs $(n_1 + 1, g(n_1+1)), \cdots, (n_3, g(n_3))$ to my database by Proposition 1 and I return $g(n_3)$ as the value of $h(n_3)$.   I can calculate $h(n)$ for any $n \in \mathbb{N}$.   From above, we get an injection $h : \mathbb{N} \to M$.   Why is my proof wrong? By the way. Suppose that a man wanna know if I have an injection $h : \mathbb{N} \to M$ or not. Then how can the man know if I have  an injection $h : \mathbb{N} \to M$ or not?	Svaki beskrajni skup sadrži brojivi podsjedak. Zašto je moj dokaz pogrešan?	$M$ je beskonačan skup. Predlog 1: Za svaki $n \in \mathbb{N}$ postoji injekcija od $\{1, \cdots, n\}$ do $M$. (1) Od $M \neq \emptyset$, postoji $x \in M$. Definirajte $f(1)$ kao $f(1) := x$. $f$ je injekcija od $\{1\}$ do $M$. (2) Pretpostavimo da postoji injekcija $f$ od $\{1, \cdots, n\}$ do $M$. Budući da $M$ je beskonačan skup, $M$0 nije prazan skup. Dakle, postoji $M$1. Definirajte $M$2 kao $M$3 i $M$4. Očito, $M$5 je injekcija od $M$6 do $M$. Neka $M$7 bude proizvoljan prirodni broj. Ako želim izračunati $M$8, onda dobijem pogrešnu injekciju $M$5 od $M$9 do $M$ Propozom 1.	elementary-set-theory,axiom-of-choice
A.82	All definite integrals evaluate to 0 using periodic functions.	I know that my reasoning is incorrect, I just don't know where I went wrong. I did discuss this with my Maths teacher, and even she could not find what I did wrong. Let us begin by assuming a function, $f(x)$ that is continuous and has an antiderivative in the interval $[0, 2\pi]$. Let $A$ be the area under the curve for $f(x)$ in the interval $[0, 2\pi]$ $A = \displaystyle \int_{0}^{2\pi}{f(x)\space\mathrm{d}x}$ Now there must exist a function, $g(x)$ such that:   $f(x) = g(x)\cdot \cos(x)$ Substituting the value of $f(x)$: $A = \displaystyle\int_{0}^{2\pi}{g(x)\cdot \cos(x)\space\mathrm{d}x}$ Using t substitution: Let $t = \sin(x)$ Then: $\mathrm{d}t = \cos(x)\space\mathrm{d}x$ And:  $x = \arcsin(t)$ Changing the limits: $t = \sin(x)$ $0$ becomes $\sin(0) = 0$ $2\pi$ becomes $\sin(2\pi) = 0$ Substituting in the definite integral: $A = \displaystyle \int_{0}^{0}{g(\arcsin(t))\space\mathrm{d}t}$ But Definite Integral where the lower and upper bounds are the same is $0$. So: $A = 0$, which is not possible. Thanks for the help.	Sve definirane integrale ocjenjuju na 0 koristeći periodične funkcije.	Znam da je moj razumski raspored pogrešan, samo ne znam gdje sam pogriješio. Razgovarao sam o tome sa svojom učiteljicom matematike, a čak i ona nije mogla pronaći što sam pogriješio. Počnimo pretpostavljajući funkciju, $f(x)$ koja je kontinuirana i ima antiderivativ u intervalu $[0, 2\pi]$. Neka $A$ bude površina ispod krivulje za $f(x)$ u intervalu $[0, 2\pi]$ $A = \displaystyle \int_{0}^{2\pi}{f(x)\space\mathrm{d}x}$. Sada mora postojati funkcija, $g(x)$ tako da: $f(x) = g(x)\cdot \cos(x)$ zamjenjuje vrijednost $f(x)$: $A = \displaystyle\int_{0}^{2\pi}{g(x)\cdot \cos(x)\space\mathrm{d}x}$ Koristeći t zamjenu: Neka $t = \sin(x)$ Zatim: $\mathrm{d}t = \cos(x)\space\mathrm{d}x$ I: $f(x)$0 Promjenjuje granice: $t = \sin(x)$ $f(x)$1 postaje $f(x)$2 $f(x)$3 $f(x)$4 Postaje zamjena u definitnom integralnom: $f(x)$5 Ali Definitnom integralnom gdje su donje i gornje granice iste je $f(x)$1. Dakle: $f(x)$6, koji nije moguće. Hvala za pomoć.	calculus,integration,trigonometry,definite-integrals,inverse-function
A.83	Is the sequence of sums of inverse of natural numbers bounded?	I'm reading through Spivak Ch.22 (Infinite Sequences) right now. He mentioned in the written portion that it's often not a trivial matter to determine the boundedness of sequences. With that in mind, he gave us a sequence to chew on before we learn more about boundedness. That sequence is: $$1, 1+\frac{1}{2}, 1+\frac{1}{2}+\frac{1}{3}, 1+\frac{1}{2}+\frac{1}{3}+\frac{1}{4}, . . .$$ I know that a sequence is bounded above if there is a number $M$ such that $a_n\leq M$ for all $n$. Any hints here?	Je li niz iznosa od obrnutoga prirodnog broja ograničen?	U pisanoj je porciji napisao da često nije trivijalno određivati ograničenost sekvenci. S tim je na umu dao nam niz na koji treba da se žvakamo prije nego što naučimo više o ograničenosti. Taj niz je: $$1, 1+\frac{1}{2}, 1+\frac{1}{2}+\frac{1}{3}{3}{2}{2}{2}+\frac{1}{2}{2}+\frac{1}{3}+\frac{1}{4}}{3}{3}{3}{3}{4}}{3}{3}{3}{1}{1}{4}}{3}{3}{3}{3}{3}{3}{3}{3}{3}{3}{3}{3}{3}}{3}{3}{3}{3}{3}{3}{3}}{3}{3}{3}{3}{3}{3}{3}{3}{3}}{3}{3}{3}}{3}{3}{3}{3}{3}}{3}{3}}{3}{3}}{3}}{3}}{3}{3}}}{3}{3}}{3}{3}}{3}}{3}}{3}}{3}}{3}}{3}}{3}{3}}}}{3}{3}}{3}}}{3}}{3}}{3}}{3}}{3}}}{3}{3}}}{3}}}}{3}{3}}}{3}{3}}}}{3}}{3}}{3}}}}{3}{3}}}{3}}{3}{3}}{3}}}}{3}{3}}{3}{3}}}{3}}{3}{3}}}}{3}}}}{3}{3}}{3}}{3}}{3}}}}}{3}{3}}{3}{3}{3}}}}{3}{3}}}{3}{3}}}{3}}}{3}{3}}}}{3}{3}}}{3}}}}{3}{3}}{3}}}{3}}}}{3}}}}}}{3}}}{3}{3}}{3}{3}}}}}}}{3}{3}}}{3}{3}}}{3}}}}}{1}}}}{1}{1}{1}{1}}{1}{1}}}}}{1}{1}}}{1}}}{1}{1}}{1}{1}{1}{1}}}}{1}{1}{1}}{1}{1}}}{1}{1}}{1}{{{{1}}}}}}}}{1}{1}{1}}}{1}{{{{1}}}}}}}{{{{{1}}}}}}}}}}}{{{{{{{{{{{{{{1}}}}}}}}}}}}}}}}}}}}}}}}}}}}{{{{{{{{{{{{{{{{{{{{{{}}}}}}}}}}}}}}}}}}}}}}}}}}}}}}}}}}}}}}{{{{{{{{{{{{{{{{{{{{{{{{{}}}}}}}}}}}}}}}}}}}}}}}}}}}}}}}}}}}}{{{{{{{{{{{{{{{{{{{{{{{{{{{	calculus,sequences-and-series,harmonic-numbers
A.84	Is the ideal generated by ${4,x}$ a principal ideal in $Z[x]$?	I've : $I=<p,x>$ is not a principal ideal in $Z[x]$ where p is prime. My question :   Is $I=<p,x>$ a principal ideal in $Z[x]$ where p is not a prime? More particularly, is the ideal generated by ${4,x}$ a principal ideal in $Z[x]$ ?	Je li ideal koji je generirao ${4,x}$ glavni ideal u $Z[x]$?	Imam: $I=<p,x>$ nije glavni ideal u $Z[x]$ gdje je p prvo. Moje pitanje: Je li $I=<p,x>$ glavni ideal u $Z[x]$ gdje p nije prvo?	abstract-algebra,ring-theory,ideals,principal-ideal-domains
A.85	Expected number of steps for a bug to reach position $N$	A bug starts at time $0$ at position $0$. At each step, the bug either moves to the right by $1$ step $(+1)$ with probability $1/2$, or returns to the origin with probability $1/2$. What is the expected number of steps for this bug to reach position $N$? I tried to first find the possibility that this bug reaches $N$ as the number of steps goes to infinity. The recurrence equation I find is $$p_n = \frac{1}{2}p_{n-1}$$, where $p_n$ is the possibility for the bug starting at position $n$ to reach $N$. We also have the boundary condition $p_N = 1$. Then we see that $p_{N-1}=2$, and that $p_0 = 2^N$, which doesn't make sense at all because it is greater than $1$. I think I should sort out the value of probability first, and think about the number of expected steps later. I'm sure there is something wrong with the recurrence equation, but what's wrong about it?	Pričekuje se da će greška doći do pozicije $N$	U svakom koraku, greška ili kreće desno po $1$ koraku $(+1)$ s vjerovatnoćom $1/2$, ili se vraća na izvor s vjerovatnoćom $1/2$. Koji je očekivani broj koraka za ovaj grešak da doseže poziciju $N$? Pokušao sam prvo pronaći mogućnost da ovaj grešak doseže $N$ kao broj koraka ide do beskonačnosti.	markov-chains,random-walk
A.86	Is it true that $\sum_{k=0}^{n}k\cdot \left(\begin{array}{l}{n}\\{k}\end{array}\right)=O\left(2 ^ {n\log _{3}n}\right)?$	Problem: Is it true that $\sum_{k=0}^{n}k\cdot \left(\begin{array}{l}{n}\\{k}\end{array}\right)=O\left( 2 ^ {n\log _{3}n}\right)?$ My start of solution: $$\sum_{k=0}^{n}k\cdot \left(\begin{array}{l}{n}\\{k}\end{array}\right)\leq \sum_{k=0}^{n}k\cdot \left(\begin{array}{l}{n}\\{\lfloor \frac{n}{2}\rfloor}\end{array}\right)\leq \frac{n\cdot(n+1)}{2}\cdot \left(\begin{array}{l}{n}\\{\lfloor \frac{n}{2}\rfloor}\end{array}\right)\leq n(n+1)! \leq nn^n \leq n^{n+1}$$ I think this upper bound is way too large and I can't seem to find a solution.	Je li istina da je $\sum_{k=0}^{n}k\cdot \left(\begin{array}{l}{n}\\{k}\end{array}\right)=O\left(2 ^ {n\log _{3}n}\right)?$	Problem: Je li istina da je $\sum_{k=0}^{n}k\cdot \left(\begin{array}{l}{n}\\{k}\end{array}\right)=O\left( 2 ^ {n\log _{3}n}\right)?$ Moj početak rješenja: $$\sum_{k=0}^{n}k\cdot \left\\begin{array}{l}{n}{k}\end{array}\right)\leq \sum_{k=0}^{n}k\cdot \left\\begin{array}{l}{n}\\{\lfloor \frac{n}{2}\rfloor}\end{rfloor}\leq \frac{n}\right}{2}\leq \c\c\n+1)}{2}\cdot \left\dot \left\begin{array}{l}{n}{2}{l}\rfloor \frac}{2}\rfloor\n}{n}{n}\n}\n}{n}{n}{n}{n}\n}{n}{n}{n}{n}{n}{n}{n}{n}{n}{n}{n}{n}{n}{n}{n}{n}{n}{n}{n}{n}{n}{n}{n}{n}{n}{n}{n}{n}{n}{n}{n}{n}{n}{n}{n}{n}{n}{n}{n}{n}{n}{n}{n}{n}{n}{n}{n}{n}{n}{n}{n}{n}{n}{n}{n}{n}{n}{n}{n}{n}{n}{n}{n}{n}{n}{n}{n}{n}{n}{n}{n}{n}{n}{n}{n}{n}{n}{n}{n}{n}{n}{n}{n}{n}{n}{n}{n}{n}{n}{n}{n}{n}{n}{n}{n}{n}{n}{n}{n}{n}{n}{n}{n}{n}{n}{n}{n}{n}{n}{n}{n}{n}{n}{n}{n}{n}{n}{n}{n}{n}{n}{n}{n}{n {n}{n}{n {n}{n}{n}{n}{n {n}{n}{n}{n}{n {n}{n {n {n}{n {n}{n {n {n}{n}{n}{n}{n {n}{n}{n {n}{n {n {n}{n}{n}{n {n}{n}{n {n}{n}{n}{n}{n}{n {n {n}{n {n {n}{n}{n}{n {n}{n}{n {n}{n}{n}{n {n}{n}{n {n}{n {n {n}{n}{n}{n {n}{n {n {n}{n}{n}{n {n {n}{n}{n}{n {n {n}{n {n}{n}{n {n}{n}{n}{n}{n}{n}{\hr}{n}{n}{n}{n}{n}{n}{n}{n}{n}{n}{n}{n}{n}{n}{n {n}{n}{n}{n}{n}{n}{n}{n}{n}{n}{n}{n {n}{nu}{nu}{nu}{nu}{nu}{nu}{nu}{nu}{nu}{nu}{nu}{nu}{nu}{nu}{nu}{nu}{nu}{nu}{nu}{nu}{nu	combinatorics,elementary-number-theory,discrete-mathematics
A.87	Is it true that $\forall n \in \Bbb{N} : (\sum_{i=1}^{n} a_{i} ) (\sum_{i=1}^{n} \frac{1}{a_{i}} ) \ge n^2$ , if all $a_{i}$ are positive?	If  $\forall i \in \Bbb{N}: a_{i} \in \Bbb{R}^+$ , is it true that $\forall n \in \Bbb{N} : \big(\sum_{i=1}^{n}a_{i}\big) \big(\sum_{i=1}^{n}  \frac{1}{a_{i}}\big) \ge n^2$ ?  I have been able to prove that this holds for $n=1$ , $n=2$, and $n=3$ using the following lemma:  Lemma 1:  Let $a,b \in \Bbb{R}^+$. If $ab =1$ then $a+b \ge 2$  For example, the case for $n=3$ can be proven like this: Let $a,b,c \in \Bbb{R}^+$. Then we have: $(a+b+c)\big(\frac{1}{a} + \frac{1}{b} + \frac{1}{c}\big) = 1 + \frac{a}{b} + \frac{a}{c} + \frac{b}{a} + 1 + \frac{b}{c} + \frac{c}{a} + \frac{c}{b}  + 1 $ $= 3 + \big(\frac{a}{b}  + \frac{b}{a}\big) + \big(\frac{a}{c} + \frac{c}{a}\big) + \big(\frac{b}{c} + \frac{c}{b}\big) $ By lemma 1, $\big(\frac{a}{b}  + \frac{b}{a}\big) \ge 2$,  $ \big(\frac{a}{c} + \frac{c}{a}\big) \ge 2$ and  $\big(\frac{b}{c} + \frac{c}{b}\big) \ge 2$ , therefore: $3 + \big(\frac{a}{b}  + \frac{b}{a}\big) + \big(\frac{a}{c} + \frac{c}{a}\big) + \big(\frac{b}{c} + \frac{c}{b}\big) \ge 3 + 2 + 2 +2 = 9 = 3^2 \ \blacksquare $ However I'm not sure the generalized version for all natural $n$ is true. I can't come up with a counterexample and when I try to prove it by induction I get stuck. Here is my attempt: Let $P(n)::\big(\sum_{i=1}^{n}a_{i}\big) \big(\sum_{i=1}^{n} \frac{1}{a_{i}}\big) \ge n^2$ Base case: $\big(\sum_{i=1}^{1}a_{i}\big) \big(\sum_{i=1}^{1} \frac{1}{a_{i}}\big) = a_{1} \frac{1}{a_{1}} = 1 = 1^2$ , so $P(1)$ is true. Inductive hypothesis:  I assume $P(n)$ is true. Inductive step: $$\left(\sum_{i=1}^{n+1}a_{i}\right) \left(\sum_{i=1}^{n+1} \frac{1}{a_{i}}\right) = \left[\left(\sum_{i=1}^{n}a_{i}\right) + a_{n+1}\right] \left[\left(\sum_{i=1}^{n} \frac{1}{a_{i}}\right) + \frac{1}{a_{n+1}}\right]$$ $$=\left(\sum_{i=1}^{n}a_{i}\right) \left[\left(\sum_{i=1}^{n} \frac{1}{a_{i}}\right) + \frac{1}{a_{n+1}}\right] + a_{n+1} \left[\left(\sum_{i=1}^{n} \frac{1}{a_{i}}\right) + \frac{1}{a_{n+1}}\right]$$ $$=\left(\sum_{i=1}^{n}a_{i}\right)\left(\sum_{i=1}^{n} \frac{1}{a_{i}}\right) +\left(\sum_{i=1}^{n}a_{i}\right) \frac{1}{a_{n+1}} + a_{n+1} \left(\sum_{i=1}^{n} \frac{1}{a_{i}}\right) +a_{n+1} \frac{1}{a_{n+1}}$$ $$=\left(\sum_{i=1}^{n}a_{i}\right)\left(\sum_{i=1}^{n} \frac{1}{a_{i}}\right) +\left(\sum_{i=1}^{n}a_{i}\right) \frac{1}{a_{n+1}} + a_{n+1} \left(\sum_{i=1}^{n} \frac{1}{a_{i}}\right) +1 $$ $$\underbrace{\ge}_{IH} n^2 + \left(\sum_{i=1}^{n}a_{i}\right) \frac{1}{a_{n+1}} + a_{n+1} \left(\sum_{i=1}^{n} \frac{1}{a_{i}}\right) + 1$$ And here I don't know what to do with the $\big( \sum_{i=1}^{n}a_{i} \big) \frac{1}{a_{n+1}} + a_{n+1} \big(\sum_{i=1}^{n} \frac{1}{a_{i}}\big)$ term. Is this inequality true? If it is, how can I prove it? If it isn't, can anyone show me a counterexample?	Je li istina da je $\forall n \in \Bbb{N} : (\sum_{i=1}^{n} a_{i} ) (\sum_{i=1}^{n} \frac{1}{a_{i}} ) \ge n^2$ ako su svi $a_{i}$ pozitivni?	Ako je $\forall i \in \Bbb{N}: a_{i} \in \Bbb{R}^+$ , je li istina da je $\forall n \in \Bbb{N} : \big(\sum_{i=1}^{n}a_{i}\big) \big(\sum_{i=1}^{n}  \frac{1}{a_{i}}\big) \ge n^2$ ? Nisam siguran da je općenita verzija za sve prirodne $\forall i \in \Bbb{N}: a_{i} \in \Bbb{R}^+$6 . Ne mogu doći do protivna primjera i kada ga isporučim indukcijom dokažem. Evo moj pokušaj: { {i}{i}{i}{i}{i}{i}{i}{i}{i}{i}{i}{i}{i}{i}{i}{i}{i}{i}{i}{i}{i}{i}{i}{i}{i}{i}{i}{i}{i}{i}{i}{i}{i}{i}{i}{i}{i}{i}{i}{i}{i}{i}{i}{i}{i}{i}{i}{i}{i}{i}{i}{i}{i}{i}{i}{i}{i}{i}{i}{i}{i}{i}{i}{i}{i}{i}}{i}{i}{i}}{i}{i}i}{i}i}i}i}i}i}i}i}i}i}i}i}i}i}i}i}i}i}i}i}i}i}i}i}i}i}i}i}i}i}i}i}i}i}i}i}i}i}i}i}i}i}i}i}i}i}i}i}i}i}i}i}i}i}i}i}i}i}i}i}i}i}i}i}i}i}i}i}i}i}i}i}i}i}i}i}i}i}i}i}i}i}i}i}i}i}i}i}i}i}i}i}i}i}i}i}i}i}i}i}i}i}i}i}i}i}i}i}i}i}i}i}i}i}i}i}i}i}i}i}i}i}i}i}i}i}i}i}i}i}i}i}i}i}i}i}i}i}i}i}i}i}i}i}i}i}i}i}i}i}i}i}i}i}i}i}i}i}i}i}i}i}i}i}i}i}i}i}i}i}i}i}i}i}i}i}i}i}i}i}i}i}i}i}i}i}i}i}i}i}i}i}i}i}i}i}i}i}i}i}i}i}i}i}i}i}i}i}i}i}i}i}i}i}i}i}i}i}i}i}i}i}i}i}i}i}i}i}i}i}i}i}i}i}i}i}i}i}i}i}i}i}i}i}i}i}i}i}i}i}i}i}i}i}i}i}i}i}i}i}i}i}i}i}i}i}i}i}i}i}i}i}i}i}i}i}i}i}i}i}i}i}i}i}i}i}i}i}i}i}i}i}i}i}i}i}i}i}i}i}i}i}i}i}i}i}i}i}i}i}i}i}i}i}i}i}i}i}i}i}i}i}i}i}i}i}i}i}i}i}i}i}i}i}i}i}i}i}i}i}i}i}i}i}i}i}i}i}i}i}i}i}i}i}i}i}i}i}i}i}i}i}i}	algebra-precalculus,inequality
A.88	Is the polynomial $x^4+10x^2+1$ reducible over $\mathbb{Z}[x]$?	Is the polynomial  $x^4+10x^2+1$  reducible over  $\mathbb{Z}[x]$?	Je li polinom $x^4+10x^2+1$ reduktivan na $\mathbb{Z}[x]$?	Je li polinom $x^4+10x^2+1$ reduktivan na $\mathbb{Z}[x]$?	abstract-algebra,ring-theory,field-theory,irreducible-polynomials
A.89	Parametrization of pythagorean-like equation	Is there any known complete parametrization of the Diophantine equation $$ A^{2} + B^{2} = C^{2} + D^{2} $$ where $A, B, C, D$ are (positive) rational numbers, or equivalently, integers?	Parametrizacija pitagorijske jednadžbe	Postoji li poznata potpuna parametrizacija Diofantinske jednadžbe $$ A^{2} + B^{2} = C^{2} + D^{2} $$ gdje su $A, B, C, D$ (pozitivni) racionalni brojevi, ili ekvivalentno, cjeline?	number-theory,diophantine-equations
A.90	Question on the definition of an Inverse matrix	By definition, if $A$ is a $ n \times n $ matrix, an inverse of $A$ is an $ n \times n $ matrix $A^{-1}$ with the property that: $$ A^{-1}A=\mathbb I_n \ \ \land \ \ AA^{-1}=\mathbb I_n \ \ \ \ (1)$$  where $ \mathbb I_n $ is the $ n \times n $ identity matrix. Are there any cases where $ A^{-1}A=\mathbb I_n$ but $AA^{-1} \neq \mathbb I_n$ or the other way around (and thus making (1) a false statement) ?	Pitanje o definiciji obrnutoga matrice	Ako je $A$ matrica $ n \times n $, onda je $A$ obrnuto matricom $A^{-1}$ s osobinom da: $$ A^{-1}A=\mathbb I_n \ \ \ \ \ \ \ \ \ \ \ \ AA^{-1}=\mathbb I_n \ \ \ \ \ \ (1)$$ gdje je $ \mathbb I_n $ matrica identiteta $ n \times n $. Postoje li slučajevi u kojima je $ A^{-1}A=\mathbb I_n$ ali $AA^{-1} \neq \mathbb I_n$ ili obrnuto (i time (1) kriva izjava)?	linear-algebra,matrices
A.91	Continuous function that reaches each value on its range exactly 2 times.	Is there a continuous function from $\mathbb{R}\to\mathbb{R}$ that reaches all of its possible values (each value in it's range) exactly $2$ times (for example, $x^2$ would be perfect if it wasn't for $0$..). Also, the same question but $3$ times. I'm almost certain that there aren't such functions but who knows haha maybe there are a bunch...	Kontinuirana funkcija koja dostiže svaku vrijednost u svom rasponu točno 2 puta.	Postoji li kontinuirana funkcija od $\mathbb{R}\to\mathbb{R}$ koja dostiže sve moguće vrijednosti (svaka vrijednost u svom rasponu) točno $2$ puta (na primjer, $x^2$ bi bio savršeni da nije za $0$..).	real-analysis,calculus
